{"allowed_evidence_refs":["bnd-1b4c85345b66e201","bnd-3e177145c894b8c3","bnd-4da3781e44eca4a5","bnd-56fce40d15e4bdad","bnd-5a9652c568b7bab7","bnd-72502954a3b274f9"],"available_operations":["artifact_inspection"],"common_base":{"assigned_job":{"input":{"capabilities":[{"capability_id":"cap-handoff","need":"trace exact artifact handoffs between jobs"},{"capability_id":"cap-inspect","need":"inspect bounded intermediate table values"},{"capability_id":"cap-frontier","need":"resume from a verified trusted frontier"},{"capability_id":"cap-localize","need":"localize a transformation to one function"},{"capability_id":"cap-compare","need":"compare selected and complete runtime evidence"},{"capability_id":"cap-ledger","need":"preserve immutable review attempts"}],"evidence_sources":[{"rank":1,"record_id":"n06-r01","source_id":"s01","source_weight":5},{"rank":2,"record_id":"n06-r02","source_id":"s02","source_weight":4},{"rank":3,"record_id":"n06-r03","source_id":"s03","source_weight":4},{"rank":4,"record_id":"n06-r04","source_id":"s04","source_weight":4},{"rank":5,"record_id":"n06-r05","source_id":"s05","source_weight":3},{"rank":6,"record_id":"n06-r06","source_id":"s06","source_weight":3},{"rank":7,"record_id":"n06-r07","source_id":"s07","source_weight":3},{"rank":8,"record_id":"n06-r08","source_id":"s08","source_weight":2}],"needs":[{"demand_score":9,"need":"isolate faulty execution branches before replay","record_id":"n06-r01","source_id":"s01","source_weight":5},{"demand_score":8,"need":"trace exact artifact handoffs between jobs","record_id":"n06-r02","source_id":"s02","source_weight":4},{"demand_score":7,"need":"inspect bounded intermediate table values","record_id":"n06-r03","source_id":"s03","source_weight":4},{"demand_score":6,"need":"resume from a verified trusted frontier","record_id":"n06-r04","source_id":"s04","source_weight":4},{"demand_score":6,"need":"localize a transformation to one function","record_id":"n06-r05","source_id":"s05","source_weight":3},{"demand_score":5,"need":"compare selected and complete runtime evidence","record_id":"n06-r06","source_id":"s06","source_weight":3},{"demand_score":4,"need":"recompute downstream jobs after an upstream repair","record_id":"n06-r07","source_id":"s07","source_weight":3},{"demand_score":3,"need":"preserve immutable review attempts","record_id":"n06-r08","source_id":"s08","source_weight":2}]},"job_id":"job_downstream_priority_recovery","observation_point":"downstream","output":{"coverage":[{"capability_id":"","coverage":"unsupported","need":"isolate faulty execution branches before replay","record_id":"n06-r01"},{"capability_id":"cap-handoff","coverage":"direct","need":"trace exact artifact handoffs between jobs","record_id":"n06-r02"},{"capability_id":"cap-inspect","coverage":"direct","need":"inspect bounded intermediate table values","record_id":"n06-r03"},{"capability_id":"cap-frontier","coverage":"direct","need":"resume from a verified trusted frontier","record_id":"n06-r04"},{"capability_id":"cap-localize","coverage":"direct","need":"localize a transformation to one function","record_id":"n06-r05"},{"capability_id":"cap-compare","coverage":"direct","need":"compare selected and complete runtime evidence","record_id":"n06-r06"},{"capability_id":"","coverage":"unsupported","need":"recompute downstream jobs after an upstream repair","record_id":"n06-r07"},{"capability_id":"cap-ledger","coverage":"direct","need":"preserve immutable review attempts","record_id":"n06-r08"}],"metadata":{"consumed_handoffs":["needs","evidence_sources"],"coverage_count":8,"instance_id":"ins-36129a2a0d354dad","job_id":"job_downstream_priority_recovery","priority_count":8,"scenario_id":"protocol-2-2-experimental-demand-recovery-v1"},"priorities":[{"capability_id":"","coverage":"unsupported","need":"isolate faulty execution branches before replay","priority":1,"provenance_rank":1,"record_id":"n06-r01","unsupported":true},{"capability_id":"","coverage":"unsupported","need":"recompute downstream jobs after an upstream repair","priority":2,"provenance_rank":7,"record_id":"n06-r07","unsupported":true},{"capability_id":"cap-handoff","coverage":"direct","need":"trace exact artifact handoffs between jobs","priority":3,"provenance_rank":2,"record_id":"n06-r02","unsupported":false},{"capability_id":"cap-inspect","coverage":"direct","need":"inspect bounded intermediate table values","priority":4,"provenance_rank":3,"record_id":"n06-r03","unsupported":false},{"capability_id":"cap-frontier","coverage":"direct","need":"resume from a verified trusted frontier","priority":5,"provenance_rank":4,"record_id":"n06-r04","unsupported":false},{"capability_id":"cap-localize","coverage":"direct","need":"localize a transformation to one function","priority":6,"provenance_rank":5,"record_id":"n06-r05","unsupported":false},{"capability_id":"cap-compare","coverage":"direct","need":"compare selected and complete runtime evidence","priority":7,"provenance_rank":6,"record_id":"n06-r06","unsupported":false},{"capability_id":"cap-ledger","coverage":"direct","need":"preserve immutable review attempts","priority":8,"provenance_rank":8,"record_id":"n06-r08","unsupported":false}],"recommendation":{"decision":"prioritize","top_need":"isolate faulty execution branches before replay"}},"stderr":"","stdout":"{\"coverage\":[{\"capability_id\":\"\",\"coverage\":\"unsupported\",\"need\":\"isolate faulty execution branches before replay\",\"record_id\":\"n06-r01\"},{\"capability_id\":\"cap-handoff\",\"coverage\":\"direct\",\"need\":\"trace exact artifact handoffs between jobs\",\"record_id\":\"n06-r02\"},{\"capability_id\":\"cap-inspect\",\"coverage\":\"direct\",\"need\":\"inspect bounded intermediate table values\",\"record_id\":\"n06-r03\"},{\"capability_id\":\"cap-frontier\",\"coverage\":\"direct\",\"need\":\"resume from a verified trusted frontier\",\"record_id\":\"n06-r04\"},{\"capability_id\":\"cap-localize\",\"coverage\":\"direct\",\"need\":\"localize a transformation to one function\",\"record_id\":\"n06-r05\"},{\"capability_id\":\"cap-compare\",\"coverage\":\"direct\",\"need\":\"compare selected and complete runtime evidence\",\"record_id\":\"n06-r06\"},{\"capability_id\":\"\",\"coverage\":\"unsupported\",\"need\":\"recompute downstream jobs after an upstream repair\",\"record_id\":\"n06-r07\"},{\"capability_id\":\"cap-ledger\",\"coverage\":\"direct\",\"need\":\"preserve immutable review attempts\",\"record_id\":\"n06-r08\"}],\"metadata\":{\"consumed_handoffs\":[\"needs\",\"evidence_sources\"],\"coverage_count\":8,\"instance_id\":\"ins-36129a2a0d354dad\",\"job_id\":\"job_downstream_priority_recovery\",\"priority_count\":8,\"scenario_id\":\"protocol-2-2-experimental-demand-recovery-v1\"},\"priorities\":[{\"capability_id\":\"\",\"coverage\":\"unsupported\",\"need\":\"isolate faulty execution branches before replay\",\"priority\":1,\"provenance_rank\":1,\"record_id\":\"n06-r01\",\"unsupported\":true},{\"capability_id\":\"\",\"coverage\":\"unsupported\",\"need\":\"recompute downstream jobs after an upstream repair\",\"priority\":2,\"provenance_rank\":7,\"record_id\":\"n06-r07\",\"unsupported\":true},{\"capability_id\":\"cap-handoff\",\"coverage\":\"direct\",\"need\":\"trace exact artifact handoffs between jobs\",\"priority\":3,\"provenance_rank\":2,\"record_id\":\"n06-r02\",\"unsupported\":false},{\"capability_id\":\"cap-inspect\",\"coverage\":\"direct\",\"need\":\"inspect bounded intermediate table values\",\"priority\":4,\"provenance_rank\":3,\"record_id\":\"n06-r03\",\"unsupported\":false},{\"capability_id\":\"cap-frontier\",\"coverage\":\"direct\",\"need\":\"resume from a verified trusted frontier\",\"priority\":5,\"provenance_rank\":4,\"record_id\":\"n06-r04\",\"unsupported\":false},{\"capability_id\":\"cap-localize\",\"coverage\":\"direct\",\"need\":\"localize a transformation to one function\",\"priority\":6,\"provenance_rank\":5,\"record_id\":\"n06-r05\",\"unsupported\":false},{\"capability_id\":\"cap-compare\",\"coverage\":\"direct\",\"need\":\"compare selected and complete runtime evidence\",\"priority\":7,\"provenance_rank\":6,\"record_id\":\"n06-r06\",\"unsupported\":false},{\"capability_id\":\"cap-ledger\",\"coverage\":\"direct\",\"need\":\"preserve immutable review attempts\",\"priority\":8,\"provenance_rank\":8,\"record_id\":\"n06-r08\",\"unsupported\":false}],\"recommendation\":{\"decision\":\"prioritize\",\"top_need\":\"isolate faulty execution branches before replay\"}}"},"behavioural_criteria":["preserve the two exact handoffs","produce the required deterministic recommendation"],"ordered_job_topology":[{"job_id":"job_downstream_priority_recovery","observation_point":true,"position":"downstream"},{"job_id":"job_upstream_demand_recovery","observation_point":false,"position":"upstream"}],"review_scope_sequence":[{"boundary_ids":["bnd-3e177145c894b8c3","bnd-4da3781e44eca4a5","bnd-72502954a3b274f9"],"job_id":"job_downstream_priority_recovery","kind":"job_boundaries"},{"handoffs":[{"direction":"upstream_to_downstream","downstream_job_id":"job_downstream_priority_recovery","handoff_name":"handoff-needs","upstream_job_id":"job_upstream_demand_recovery"},{"direction":"upstream_to_downstream","downstream_job_id":"job_downstream_priority_recovery","handoff_name":"handoff-evidence-sources","upstream_job_id":"job_upstream_demand_recovery"}],"kind":"handoffs"},{"boundary_ids":["bnd-1b4c85345b66e201","bnd-56fce40d15e4bdad","bnd-5a9652c568b7bab7"],"job_id":"job_upstream_demand_recovery","kind":"job_boundaries"}],"review_task":"Starting from the observed downstream execution and final result, determine whether a behaviorally significant fault exists anywhere in the two-job chain. Review the downstream boundaries first, trace to the upstream producer when the supplied evidence supports it, and return one top root-cause boundary from either job or no suspect.","schema_version":"1","section":{"assigned_boundary_ids":["bnd-3e177145c894b8c3","bnd-4da3781e44eca4a5","bnd-72502954a3b274f9","bnd-1b4c85345b66e201","bnd-56fce40d15